{
  "$schema": "https://json-schema.org/draft/2020-12/schema",
  "$id": "https://local-symphony.dev/schemas/tools/handoff_submit.input.schema.json",
  "title": "handoff.submit input",
  "type": "object",
  "additionalProperties": false,
  "required": ["summary", "changed_files", "tests", "risks", "verification", "followups"],
  "properties": {
    "summary": { "type": "string", "minLength": 1, "pattern": "\\S" },
    "changed_files": {
      "type": "array",
      "items": { "type": "string", "minLength": 1 }
    },
    "tests": {
      "type": "array",
      "items": { "type": "string" }
    },
    "risks": {
      "type": "array",
      "items": { "type": "string" }
    },
    "verification": {
      "type": "array",
      "items": { "type": "string" }
    },
    "followups": {
      "type": "array",
      "items": { "type": "string" },
      "default": []
    },
    "target_state": { "const": "Human Review" }
  }
}
